{
  "format": "mid-century-ink-rig",
  "version": 1,
  "name": "Ink demonstrator",
  "canvas": {
    "width": 600,
    "height": 700
  },
  "svg": "<svg xmlns=\"http://www.w3.org/2000/svg\" viewBox=\"0 0 600 700\"><title>Ink demonstrator</title><g id=\"thigh-art-right\" transform=\"matrix(-0.1736481776669303 0.984807753012208 -0.984807753012208 -0.1736481776669303 280 400)\"><path d=\"M -10,-15 L 114,-10 L 115,10 L -10,18 Z\" fill=\"#242136\"/></g><g id=\"shin-art-right\" transform=\"matrix(-0.06975647374412525 0.9975640502598241 -0.9975640502598241 -0.06975647374412525 260.89870045663764 508.3288528313429)\"><path d=\"M -9,-10 L 112,-6 L 112,9 L -10,12 Z\" fill=\"#242136\"/></g><g id=\"foot-art-right\" transform=\"matrix(0.9999999999999998 -8.326672684688674e-17 8.326672684688674e-17 0.9999999999999998 253.5742707135045 613.0730781086244)\"><path d=\"M -8,-6 L 23,-5 L 45,7 L 43,13 L -9,12 Z\" fill=\"#242136\"/></g><g id=\"thigh-art-left\" transform=\"matrix(0.12186934340514749 0.992546151641322 -0.992546151641322 0.12186934340514749 322 400)\"><path d=\"M -10,-15 L 114,-10 L 115,10 L -10,18 Z\" fill=\"#242136\"/></g><g id=\"shin-art-left\" transform=\"matrix(0.017452406437283532 0.999847695156391 -0.999847695156391 0.017452406437283532 335.4056277745662 509.1800766805454)\"><path d=\"M -9,-10 L 112,-6 L 112,9 L -10,12 Z\" fill=\"#242136\"/></g><g id=\"foot-art-left\" transform=\"matrix(0.9999999999999999 -1.5959455978986625e-16 1.5959455978986625e-16 0.9999999999999999 337.2904876697928 617.1636277574356)\"><path d=\"M -8,-6 L 23,-5 L 45,7 L 43,13 L -9,12 Z\" fill=\"#242136\"/></g><g id=\"upper-art-right\" transform=\"matrix(-0.5000000000000001 0.8660254037844386 -0.8660254037844386 -0.5000000000000001 270 270)\"><path d=\"M -10,-13 L 48,-17 L 61,10 L -9,15 Z\" fill=\"#bd4b35\"/><path d=\"M 45,-8 L 106,-4 L 106,6 L 47,11 Z\" fill=\"#eed8b9\"/></g><g id=\"fore-art-right\" transform=\"matrix(-0.2588190451025209 0.9659258262890682 -0.9659258262890682 -0.2588190451025209 225 347.9422863405995)\"><path d=\"M -8,-6 L 98,-4 L 96,5 L -8,8 Z\" fill=\"#eed8b9\"/><path d=\"M 6,8 L 75,5\" fill=\"none\" stroke=\"#242136\" stroke-width=\"1.5\"/></g><g id=\"hand-art-right\" transform=\"matrix(-0.2588190451025209 0.9659258262890682 -0.9659258262890682 -0.2588190451025209 200.41219071526052 439.70523983806095)\"><path d=\"M -7,-5 L 20,-8 L 30,-2 L 23,9 L -6,6 Z\" fill=\"#eed8b9\"/><path d=\"M 16,-2 L 25,0 M 14,3 L 22,5\" fill=\"none\" stroke=\"#242136\" stroke-width=\"1.3\"/></g><g id=\"upper-art-left\" transform=\"matrix(0.42261826174069944 0.9063077870366499 -0.9063077870366499 0.42261826174069944 335 268)\"><path d=\"M -10,-13 L 48,-17 L 61,10 L -9,15 Z\" fill=\"#bd4b35\"/><path d=\"M 45,-8 L 106,-4 L 106,6 L 47,11 Z\" fill=\"#eed8b9\"/></g><g id=\"fore-art-left\" transform=\"matrix(0.0871557427476582 0.9961946980917455 -0.9961946980917455 0.0871557427476582 377.26182617406994 358.630778703665)\"><path d=\"M -8,-6 L 98,-4 L 96,5 L -8,8 Z\" fill=\"#eed8b9\"/><path d=\"M 6,8 L 75,5\" fill=\"none\" stroke=\"#242136\" stroke-width=\"1.5\"/></g><g id=\"hand-art-left\" transform=\"matrix(0.0871557427476582 0.9961946980917455 -0.9961946980917455 0.0871557427476582 385.1058430213592 448.2883015319221)\"><path d=\"M -7,-5 L 20,-8 L 30,-2 L 23,9 L -6,6 Z\" fill=\"#eed8b9\"/><path d=\"M 16,-2 L 25,0 M 14,3 L 22,5\" fill=\"none\" stroke=\"#242136\" stroke-width=\"1.3\"/></g><g id=\"torso-art\" transform=\"matrix(6.123233995736766e-17 -1 1 6.123233995736766e-17 300 400)\"><g transform=\"rotate(90) translate(0 -120)\"><path d=\"M -35,-24 L 37,-19 L 21,126 L -29,121 Z\" fill=\"#bd4b35\"/><path d=\"M -9,-20 L 2,14 L 17,-19\" fill=\"none\" stroke=\"#242136\" stroke-width=\"2\"/><path d=\"M 7,34 L 3,100\" fill=\"none\" stroke=\"#242136\" stroke-width=\"1.5\"/></g></g><g id=\"head-art\" transform=\"matrix(6.123233995736766e-17 -1 1 6.123233995736766e-17 292 260)\"><g transform=\"rotate(90)\"><path d=\"M -28,-66 L 17,-72 L 35,-28 L 21,-24 L 18,13 L -24,3 Z\" fill=\"#eed8b9\"/><path d=\"M -30,-67 L 17,-77 L 26,-57 L -8,-55 L -24,-29 Z\" fill=\"#242136\"/><circle cx=\"0\" cy=\"-34\" r=\"2\" fill=\"#242136\"/><circle cx=\"18\" cy=\"-36\" r=\"2\" fill=\"#242136\"/><path d=\"M 12,-31 L 21,-20 L 13,-18 M 0,-8 Q 9,-2 18,-9\" fill=\"none\" stroke=\"#242136\" stroke-width=\"1.8\"/></g></g></svg>",
  "bones": [
    {
      "id": "root",
      "parentId": null,
      "role": "root",
      "rest": {
        "x": 300,
        "y": 400,
        "rotation": 0
      },
      "length": 0,
      "limits": {
        "min": -180,
        "max": 180
      }
    },
    {
      "id": "torso",
      "parentId": "root",
      "role": "torso",
      "rest": {
        "x": 0,
        "y": 0,
        "rotation": -90
      },
      "length": 140,
      "limits": {
        "min": -25,
        "max": 25
      }
    },
    {
      "id": "head",
      "parentId": "torso",
      "role": "head",
      "rest": {
        "x": 140,
        "y": -8,
        "rotation": 0
      },
      "length": 70,
      "limits": {
        "min": -35,
        "max": 35
      }
    },
    {
      "id": "upper-left",
      "parentId": "torso",
      "role": "arm.left.upper",
      "rest": {
        "x": 132,
        "y": 35,
        "rotation": 155
      },
      "length": 100,
      "limits": {
        "min": -130,
        "max": 90
      }
    },
    {
      "id": "fore-left",
      "parentId": "upper-left",
      "role": "arm.left.forearm",
      "rest": {
        "x": 100,
        "y": 0,
        "rotation": 20
      },
      "length": 90,
      "limits": {
        "min": -145,
        "max": 90
      }
    },
    {
      "id": "hand-left",
      "parentId": "fore-left",
      "role": "arm.left.hand",
      "rest": {
        "x": 90,
        "y": 0,
        "rotation": 0
      },
      "length": 24,
      "limits": {
        "min": -65,
        "max": 65
      }
    },
    {
      "id": "upper-right",
      "parentId": "torso",
      "role": "arm.right.upper",
      "rest": {
        "x": 130,
        "y": -30,
        "rotation": 210
      },
      "length": 90,
      "limits": {
        "min": -90,
        "max": 130
      }
    },
    {
      "id": "fore-right",
      "parentId": "upper-right",
      "role": "arm.right.forearm",
      "rest": {
        "x": 90,
        "y": 0,
        "rotation": -15
      },
      "length": 95,
      "limits": {
        "min": -90,
        "max": 145
      }
    },
    {
      "id": "hand-right",
      "parentId": "fore-right",
      "role": "arm.right.hand",
      "rest": {
        "x": 95,
        "y": 0,
        "rotation": 0
      },
      "length": 24,
      "limits": {
        "min": -65,
        "max": 65
      }
    },
    {
      "id": "thigh-left",
      "parentId": "root",
      "role": "leg.left.upper",
      "rest": {
        "x": 22,
        "y": 0,
        "rotation": 83
      },
      "length": 110,
      "limits": {
        "min": -60,
        "max": 60
      }
    },
    {
      "id": "shin-left",
      "parentId": "thigh-left",
      "role": "leg.left.lower",
      "rest": {
        "x": 110,
        "y": 0,
        "rotation": 6
      },
      "length": 108,
      "limits": {
        "min": -10,
        "max": 130
      }
    },
    {
      "id": "foot-left",
      "parentId": "shin-left",
      "role": "leg.left.foot",
      "rest": {
        "x": 108,
        "y": 0,
        "rotation": -89
      },
      "length": 40,
      "limits": {
        "min": -35,
        "max": 35
      }
    },
    {
      "id": "thigh-right",
      "parentId": "root",
      "role": "leg.right.upper",
      "rest": {
        "x": -20,
        "y": 0,
        "rotation": 100
      },
      "length": 110,
      "limits": {
        "min": -60,
        "max": 60
      }
    },
    {
      "id": "shin-right",
      "parentId": "thigh-right",
      "role": "leg.right.lower",
      "rest": {
        "x": 110,
        "y": 0,
        "rotation": -6
      },
      "length": 105,
      "limits": {
        "min": -10,
        "max": 130
      }
    },
    {
      "id": "foot-right",
      "parentId": "shin-right",
      "role": "leg.right.foot",
      "rest": {
        "x": 105,
        "y": 0,
        "rotation": -94
      },
      "length": 40,
      "limits": {
        "min": -35,
        "max": 35
      }
    }
  ],
  "bindings": [
    {
      "id": "bind-thigh-art-right",
      "svgId": "thigh-art-right",
      "boneId": "thigh-right",
      "bindMatrix": [
        -0.17364817766693033,
        -0.9848077530122081,
        0.9848077530122081,
        -0.17364817766693033,
        -345.30161145814276,
        345.2054419101905
      ]
    },
    {
      "id": "bind-shin-art-right",
      "svgId": "shin-art-right",
      "boneId": "shin-right",
      "bindMatrix": [
        -0.06975647374412527,
        -0.9975640502598244,
        0.9975640502598244,
        -0.06975647374412527,
        -488.8912159460848,
        295.7223926109591
      ]
    },
    {
      "id": "bind-foot-art-right",
      "svgId": "foot-art-right",
      "boneId": "foot-right",
      "bindMatrix": [
        1.0000000000000002,
        8.326672684688678e-17,
        -8.326672684688678e-17,
        1.0000000000000002,
        -253.5742707135045,
        -613.0730781086245
      ]
    },
    {
      "id": "bind-thigh-art-left",
      "svgId": "thigh-art-left",
      "boneId": "thigh-left",
      "bindMatrix": [
        0.12186934340514749,
        -0.992546151641322,
        0.992546151641322,
        0.12186934340514749,
        -436.2603892329863,
        270.85212346644664
      ]
    },
    {
      "id": "bind-shin-art-left",
      "svgId": "shin-art-left",
      "boneId": "shin-left",
      "bindMatrix": [
        0.01745240643728354,
        -0.9998476951563914,
        0.9998476951563914,
        0.01745240643728354,
        -514.956161425872,
        326.4681262248865
      ]
    },
    {
      "id": "bind-foot-art-left",
      "svgId": "foot-art-left",
      "boneId": "foot-left",